{
  "schema": "cmath.paper-entry-sol-score/v1",
  "scorerModel": "gpt-5.6-sol",
  "promptVersion": "sol-entry-score-prompt-v1",
  "candidateArtifact": "benchmarks/model-outputs/entry-module/knot-hopf-rt-parallel-v1.4-high-consolidation-v1-run2.json",
  "goldRevision": "gold-v2-objective-conventions",
  "caseId": "knot-hopf-rt",
  "correctness": 18,
  "completeness": 16,
  "solEntryScore": 34,
  "verdict": "usable",
  "summary": "The candidate covers nearly the entire mathematical route from framed-link surgery and Kirby calculus through ribbon Hopf algebras, modular categories, purification, Kirby colors, and the normalized RT invariant. Most central statements and page locators are accurate. However, four entries contain literal extraction-corruption placeholders, the negligible-module discussion asserts a generally invalid equivalence, the Kirby-reduction implication is not correctly extracted, external attributions are not explicitly recorded, and 182 entries substantially over-fragment and duplicate the 37-entry gold structure.",
  "strengths": [
    "Captures all principal external and internal results: Lickorish–Wallace surgery, Kirby calculus, the Turaev ribbon-graph functor, modular-Hopf purification, and the RT invariance theorem.",
    "Accurately reproduces the selected Turaev-style conventions for the ribbon element, the pivotal factor uv, quantum trace, modular rank D, anomaly constant Delta, and the normalized RT formula.",
    "Covers the main supporting definitions, including framed links, surgery presentations, braiding, duality, ribbon categories, quasitriangular and ribbon Hopf algebras, modular categories, Kirby color, and modular Hopf algebras.",
    "Entry types are generally sensible, and page locators follow the paper's mathematical progression.",
    "The key RT theorem correctly states invariance under Kirby moves and dependence only on the orientation-preserving homeomorphism class."
  ],
  "issues": [
    "Four statements contain literal terminal-corruption text '[...][0m'; most seriously, paper:def:twist loses both the twist morphism and its defining compatibility equation.",
    "paper:def:negligible-module and paper:def:negligible-module-equivalence incorrectly claim that vanishing quantum trace of id_Z is equivalent to vanishing quantum trace of every endomorphism of Z; this is not true in general.",
    "The candidate does not properly extract the gold definition of a negligible morphism h:X->Y via tr_q(g composed with h)=0 for every g:Y->X, and its assertion that morphisms passing through a negligible module are precisely what purification removes is too strong.",
    "rt:proposition:kirby-invariance-condition gives only the necessary direction 'a 3-manifold invariant must be Kirby invariant'; it misses the gold reduction proposition that a framed-link quantity invariant under the Kirby moves descends to a 3-manifold invariant.",
    "The blow-up/blow-down normalization lemma and the ensuing presentation-independence proposition are not cleanly delimited as independent entries, although their content is partially folded into the final RT theorem.",
    "External results are recognizable by their names, but the candidate lacks explicit source-attribution metadata corresponding to the gold references for Lickorish–Wallace, Kirby, and Turaev.",
    "The artifact is heavily over-fragmented: many definitions are split into notation, calculation, algorithm, and duplicate rt/paper entries, such as two surgery constructions, multiple writhe-framing entries, three Yang–Baxter entries, duplicated graphical-calculus generators, duplicated R-matrix braiding entries, and repeated purification conclusions.",
    "Several extracted entries are peripheral table rows or explanatory observations rather than distinct mathematical entries, weakening delimitation and redundancy control."
  ],
  "entryLevelComparison": [
    {
      "goldEntryId": "rt:entry:lickorish-wallace",
      "candidateEntryIds": [
        "paper:thm:lickorish-wallace-surgery",
        "rt:thm:integer-surgery"
      ],
      "status": "covered_with_duplication",
      "notes": "The mathematical content and page are correct, but the same theorem is extracted twice and explicit external-source metadata is absent."
    },
    {
      "goldEntryId": "rt:entry:kirby-calculus",
      "candidateEntryIds": [
        "rt:thm:kirby-calculus"
      ],
      "status": "accurately_covered",
      "notes": "The iff statement and all three move types are faithfully represented on page 3."
    },
    {
      "goldEntryId": "rt:entry:kirby-reduction",
      "candidateEntryIds": [
        "rt:proposition:kirby-invariance-condition"
      ],
      "status": "direction_reversed_or_incomplete",
      "notes": "The candidate states a necessary condition for an already-defined 3-manifold invariant, whereas the gold proposition states the sufficient descent criterion from Kirby-invariant link data."
    },
    {
      "goldEntryId": "rt:entry:twist",
      "candidateEntryIds": [
        "paper:def:twist",
        "paper:def:duality-twist-compatibility"
      ],
      "status": "damaged",
      "notes": "The principal twist entry contains corruption placeholders and omits its defining tensor-product identity; part of the duality compatibility survives separately."
    },
    {
      "goldEntryId": "rt:entry:turaev-ribbon-graph-functor",
      "candidateEntryIds": [
        "paper:thm:turaev-ribbon-graph-functor"
      ],
      "status": "accurately_covered",
      "notes": "The functor, closed-graph codomain, and scalar specialization are correctly stated."
    },
    {
      "goldEntryId": "rt:entry:ribbon-hopf-algebra",
      "candidateEntryIds": [
        "paper:def:ribbon-hopf-algebra"
      ],
      "status": "accurately_covered",
      "notes": "Centrality, invertibility, coproduct, antipode, and counit conditions match the selected convention."
    },
    {
      "goldEntryId": "rt:entry:quantum-trace",
      "candidateEntryIds": [
        "paper:calculation:quantum-trace",
        "rt:prop:trace-compatibility"
      ],
      "status": "covered_with_fragmentation",
      "notes": "The uv convention and equality with categorical trace are correct but split across two entries."
    },
    {
      "goldEntryId": "rt:entry:negligible-module",
      "candidateEntryIds": [
        "paper:def:negligible-module",
        "paper:def:negligible-module-equivalence"
      ],
      "status": "mathematically_inaccurate",
      "notes": "The universal endomorphism condition is stated, but the candidate adds the false general equivalence with tr_q(id_Z)=0 and omits the gold negligible-morphism definition."
    },
    {
      "goldEntryId": "rt:entry:turaev-purification-theorem",
      "candidateEntryIds": [
        "paper:thm:modular-hopf-purification",
        "paper:thm:purification-modular-category",
        "paper:thm:turaev-quasimodular"
      ],
      "status": "covered_with_duplication",
      "notes": "The quasimodular intermediate category and modular quotient are captured correctly, but the result is unnecessarily split and repeated."
    },
    {
      "goldEntryId": "rt:entry:handle-slide-invariance",
      "candidateEntryIds": [
        "rt:prop:kirby-color-handle-slide"
      ],
      "status": "covered",
      "notes": "The essential handle-slide invariance of the Kirby color is present, though the candidate gives less operational detail than the gold statement."
    },
    {
      "goldEntryId": "rt:entry:signature-normalization",
      "candidateEntryIds": [
        "paper:calculation:rt-normalization"
      ],
      "status": "accurately_covered",
      "notes": "The formula Delta^{sigma(L)} D^{-sigma(L)-m-1}{L} matches the selected gold convention."
    },
    {
      "goldEntryId": "rt:entry:blowup-invariance",
      "candidateEntryIds": [
        "paper:thm:rt-invariant"
      ],
      "status": "implicit_only",
      "notes": "Kirby-move invariance is asserted globally, but the separate normalization lemma for adding or deleting a disjoint plus-or-minus-one-framed unknot is not extracted."
    },
    {
      "goldEntryId": "rt:entry:rt-invariant",
      "candidateEntryIds": [
        "paper:thm:rt-invariant"
      ],
      "status": "accurately_covered",
      "notes": "The modular-category hypotheses, chosen rank, Kirby invariance, and orientation-preserving homeomorphism invariance are all present."
    }
  ]
}
